{
  "$schema": "https://json-schema.org/draft/2020-12/schema",
  "additionalProperties": false,
  "properties": {
    "id": {
      "oneOf": [
        {
          "type": "integer"
        },
        {
          "type": "string"
        },
        {
          "type": "null"
        }
      ]
    },
    "jsonrpc": {
      "enum": [
        "2.0"
      ],
      "type": "string"
    },
    "method": {
      "enum": [
        "raw/apply-edits"
      ],
      "type": "string"
    },
    "params": {
      "additionalProperties": false,
      "properties": {
        "edits": {
          "items": {
            "additionalProperties": true,
            "type": "object"
          },
          "type": "array"
        },
        "fileHashes": {
          "items": {
            "additionalProperties": true,
            "type": "object"
          },
          "type": "array"
        },
        "fileOperations": {
          "items": {
            "additionalProperties": true,
            "type": "object"
          },
          "type": "array"
        }
      },
      "required": [
        "edits",
        "fileHashes"
      ],
      "type": "object"
    }
  },
  "required": [
    "jsonrpc",
    "method",
    "params",
    "id"
  ],
  "title": "Kast raw/apply-edits JSON-RPC request",
  "type": "object"
}
