{
  "id": 1,
  "jsonrpc": "2.0",
  "method": "raw/apply-edits",
  "params": {
    "edits": [
      {
        "content": "val renamed = Widget()\n",
        "endOffset": 180,
        "filePath": "/absolute/path/to/workspace/src/main/kotlin/example/Widget.kt",
        "startOffset": 120
      }
    ],
    "fileHashes": [
      {
        "filePath": "/absolute/path/to/workspace/src/main/kotlin/example/Widget.kt",
        "sha256": "abc123"
      }
    ]
  }
}
